Account,Shelf,Title,Base Title,Series,Series Number,Author,Lindsay Rating,Goodreads Avg Rating,Rating Delta,Rating Band,Read Date,Date Added,Pages,Published Year,ISBN,Goodreads Book ID,Goodreads Review URL,Goodreads Book URL,Cover URL,Other Shelves,Inferred Category,Romance?,Fantasy/Paranormal?,Dark/Thriller?,Review Text,Description
Lindsay Markman,read,The Poison Daughter,The Poison Daughter,"","",Sheila Masterson,5,4.41,0.59,Loved,2026-03-27,2026-03-27,668,2025,"",230848723,https://www.goodreads.com/review/show/8395928925,https://www.goodreads.com/book/show/230848723,https://i.gr-assets.com/images/S/compressed.photo.goodreads.com/books/1756901545l/230848723._SY475_.jpg,"",Fantasy Romance,Yes,Yes,Yes,"","To err is human. To avenge is Divine. Every person Harlow Carrenwell kisses dies immediately, and that’s the way she likes it. The poison-lipped youngest daughter of Lunameade’s magical founding family has used her power to annihilate their opposition. Her first husband is in the ground. Her new betrothed is next. But the merry widow has a secret. When she’s not acting as an assassin at her parents' whims, she moonlights as a vigilante for abused women in their walled-off city. Meet a man. Lure him in. Kill him with a kiss. Until one night Harlow kisses a mark and he doesn’t die. Worse, her invincible partner in passion is her new betrothed, Henry Havenwood, and now he knows about her double life. Instead of selling her out and bringing the rival families to blows, he does something much more sinister—whisks her away to wed in his wild mountain fort. Harlow doesn’t trust Henry, but the only way to protect her family and the city of Lunameade is to figure out what his family is planning. Cursed with a husband she can’t kill and trapped in a fort miles of vampire-infested woods from home, Harlow’s survival requires her to do the impossible: Make the man who knows she’s a killer fall in love with her anyway. The Poison Daughter is a standalone dark fantasy romance that combines the vigilante justice for abusive men of Promising Young Woman with a romantasy arranged marriage and a dash of vampires."
Lindsay Markman,read,"Daggermouth (The Heart, #1)",Daggermouth,The Heart,1,H.M.  Wolfe,4,4.36,-0.36,Liked a lot,2026-03-10,2026-03-27,516,2025,"",247928235,https://www.goodreads.com/review/show/8331435480,https://www.goodreads.com/book/show/247928235,https://i.gr-assets.com/images/S/compressed.photo.goodreads.com/books/1774961536l/247928235._SY475_.jpg,"",Fantasy Romance,Yes,Yes,"","","Set in a corrupt surveillance state ruled by the masked elite, this true enemies-to-lovers dystopian romance that’s Conform meets V For Vendetta follows a mercenary who botches the assassination of the president’s son and ends up forced to marry him. The first thing you’ll learn in New Found Haven is that mercy doesn’t exist. The second thing is that, from the highest glass atrium in the Heart to the windowless slums of the Boundary, the Veyra are always watching. The last lesson is the hardest, but you must remember it: Love outside of your ring is a death sentence. The city is carved into rings of privilege and poverty, ruled by the masked elite who will do whatever it takes to hold onto power. Obedience is demanded. Rebellion is crushed. Greyson Serel has spent his life caught between two worlds. Publicly, he’s the flawless heir to the presidency. Privately, he’s entangled in secrets that could topple the regime. But when he’s forced into a political marriage meant to bind him tighter to the government’s brutal laws, he finds himself shackled to a bride as lethal as she is unwilling. Shadera Kael is a mercenary raised to kill, not to wed. Yet when her bullet misses its mark, survival leaves her tied to the very man she was sent to eliminate. Trapped inside the corrupt heart of the city, she becomes both prisoner and wife, her every step watched, her every move tested. Their union is no love story—it’s a battlefield. As secrets come to light and betrayals fester within the walls of power, Greyson and Shadera must decide between annihilating each other or burning the city to the ground together. In a world where passion has consequences and loyalty is paid for in blood, their forced bond may be the spark that ignites a revolution. Or the fire that consumes them both."
Lindsay Markman,read,"Insatiable (The Edge of Darkness, #1)",Insatiable,The Edge of Darkness,1,Leigh Rivers,4,4.15,-0.15,Liked a lot,2026-03-26,2026-03-26,413,2023,"",187012471,https://www.goodreads.com/review/show/8383170701,https://www.goodreads.com/book/show/187012471,https://i.gr-assets.com/images/S/compressed.photo.goodreads.com/books/1688984179l/187012471._SY475_.jpg,"",Romance,Yes,"",Yes,"","IF HE CAN'T HAVE HER, NO ONE ELSE CAN Kade Mitchell is obsessed with someone he despises. A snake in an angel’s skin, Stacey Rhodes is everything he can’t forget–the girl who shattered his heart and drove him deep into the darkness of the underworld. He watched her for years. Killed anyone who came close to her. But now, granted a brief moment of freedom from the life he’s trapped in, he’s back home and driven to claim her again, breaking every rule he’s ever made for himself. Not even his hatred can stop the pull between them. But he’ll never forgive her… will he? As this is a dark romance, the author highly recommends seeing the 'content warning' page."
Lindsay Markman,read,"Glow (The Plated Prisoner, #4)",Glow,The Plated Prisoner,4,Raven Kennedy,4,4.11,-0.11,Liked a lot,2026-03-17,2026-03-23,738,2022,"",58159316,https://www.goodreads.com/review/show/8423618146,https://www.goodreads.com/book/show/58159316,https://i.gr-assets.com/images/S/compressed.photo.goodreads.com/books/1641240565l/58159316._SY475_.jpg,"",Fantasy Romance,Yes,Yes,Yes,"","""I was nothing but a road to Midas. A means to get to where he wanted to go, and I paved that path in gold."" My life has been made up of gilded lies. But death has been shaped from rot. Like a phoenix caught fire, I will need to rise from the ashes and learn to wield my own power. Because my wings may have been clipped, but I am not in a cage, and I'm finally free to fly from the frozen kingdoms I've been kept in. Yet the world doesn't want to let me. That's the thing when you turn against a king—everyone else turns against you. Good thing I have a different king in my corner. But even with the dark threat of Slade Ravinger, the other monarchs are coming for me. So I will fight for him and he will kill for me, and if we need to become the villains, then so be it. Because so long as I live in this world, I won't be used again. Please note: This is an adult fantasy series with dark elements that may be triggering, including past emotional and physical trauma, violence, adult language, and explicit romance. Read at your own discretion."
Lindsay Markman,read,"The Will of the Many (Hierarchy, #1)",The Will of the Many,Hierarchy,1,James Islington,5,4.57,0.43,Loved,2026-03-22,2026-03-22,640,2023,1982141190,58416952,https://www.goodreads.com/review/show/8431814255,https://www.goodreads.com/book/show/58416952,https://i.gr-assets.com/images/S/compressed.photo.goodreads.com/books/1670363463l/58416952._SY475_.jpg,"",Fantasy / Paranormal,"",Yes,Yes,"","At the elite Catenan Academy, a young fugitive uncovers layered mysteries and world-changing secrets in this new fantasy series by internationally bestselling author of The Licanius Trilogy, James Islington. AUDI. VIDE. TACE. The Catenan Republic – the Hierarchy – may rule the world now, but they do not know everything. I tell them my name is Vis Telimus. I tell them I was orphaned after a tragic accident three years ago, and that good fortune alone has led to my acceptance into their most prestigious school. I tell them that once I graduate, I will gladly join the rest of civilised society in allowing my strength, my drive and my focus – what they call Will – to be leeched away and added to the power of those above me, as millions already do. As all must eventually do. I tell them that I belong, and they believe me. But the truth is that I have been sent to the Academy to find answers. To solve a murder. To search for an ancient weapon. To uncover secrets that may tear the Republic apart. And that I will never, ever cede my Will to the empire that executed my family. To survive, though, I will still have to rise through the Academy’s ranks. I will have to smile, and make friends, and pretend to be one of them and win. Because if I cannot, then those who want to control me, who know my real name, will no longer have any use for me. And if the Hierarchy finds out who I truly am, they will kill me."
Lindsay Markman,read,Gold,Gold,"","",Raven Kennedy,4,4.10,-0.1,Liked a lot,2026-03-19,2026-03-19,674,2023,"",61314205,https://www.goodreads.com/review/show/8423618297,https://www.goodreads.com/book/show/61314205,https://i.gr-assets.com/images/S/compressed.photo.goodreads.com/books/1679863754l/61314205._SY475_.jpg,"",Fantasy / Paranormal,"",Yes,"","","Every end is also a beginning. I was going to die. If it weren’t for Slade, I would have. But he ripped the world open for me and I went through it. To Annwyn. To home. Annwyn is the realm of the fae, a magical place full of beauty and danger. Here, I am known as Lyäri Ulvêre – the golden one gone. And there are people in this world who want to keep me that way. But I am not that girl in the gilded cage anymore, and no one is going to use me again. Or stop me from finding my way back to Slade. I am my own woman. And I will find him. In this world, or the next."
Lindsay Markman,read,"Gleam (The Plated Prisoner, #3)",Gleam,The Plated Prisoner,3,Raven Kennedy,5,4.37,0.63,Loved,2026-03-15,2026-03-19,681,2021,"",57214537,https://www.goodreads.com/review/show/8423617984,https://www.goodreads.com/book/show/57214537,https://i.gr-assets.com/images/S/compressed.photo.goodreads.com/books/1614345575l/57214537._SY475_.jpg,"",Fiction,"","",Yes,"","King Midas made me the woman I am today. Notorious. Unattainable. His. The thing about being confined is that you believe it’s to keep the bad out... Until you realize it’s about keeping you in. I’m now in a strange kingdom surrounded by liars, with no allies of my own, but I won’t sit idly by and let myself wither. No, there’s something that’s bloomed from the pit of my repression. Something dark. Something angry. But the last thing I expected was for my anger to call out to him . King Ravinger. He’s sinister and powerful and entirely too seductive. I’ve learned my lesson with trusting manipulative kings, so why does my chest constrict every time he’s near? I need to tread carefully, or I’m at risk of losing much more than just my freedom. Regret and revenge war inside of me, and I need to figure out a plan fast before I get tangled up in the schemes of kings and queens. Because I won’t be caught in a cage again. No, this time, It’ll be me setting the trap... I just hope my heart comes out of this unscathed."
Lindsay Markman,read,The Song of Achilles,The Song of Achilles,"","",Madeline Miller,4,4.28,-0.28,Liked a lot,2026-03-13,2026-03-19,408,2011,"",13623848,https://www.goodreads.com/review/show/8418573295,https://www.goodreads.com/book/show/13623848,https://i.gr-assets.com/images/S/compressed.photo.goodreads.com/books/1357177533l/13623848._SY475_.jpg,"",Fantasy Romance,Yes,Yes,"","","Alternate cover edition of ISBN 9780062060624 . Achilles, ""the best of all the Greeks,"" son of the cruel sea goddess Thetis and the legendary king Peleus, is strong, swift, and beautiful, irresistible to all who meet him. Patroclus is an awkward young prince, exiled from his homeland after an act of shocking violence. Brought together by chance, they forge an inseparable bond, despite risking the gods' wrath. They are trained by the centaur Chiron in the arts of war and medicine, but when word comes that Helen of Sparta has been kidnapped, all the heroes of Greece are called upon to lay siege to Troy in her name. Seduced by the promise of a glorious destiny, Achilles joins their cause, and torn between love and fear for his friend, Patroclus follows. Little do they know that the cruel Fates will test them both as never before and demand a terrible sacrifice."
Lindsay Markman,read,"Glint (The Plated Prisoner, #2)",Glint,The Plated Prisoner,2,Raven Kennedy,5,4.15,0.85,Loved,2026-03-13,2026-03-19,482,2021,"",56530123,https://www.goodreads.com/review/show/8423617802,https://www.goodreads.com/book/show/56530123,https://i.gr-assets.com/images/S/compressed.photo.goodreads.com/books/1610111193l/56530123._SY475_.jpg,"",Fantasy Romance,Yes,Yes,Yes,"","For ten years, I’ve lived in a gilded cage inside King Midas’s golden castle. But one night changed everything. Now I’m here, a prisoner of Fourth Kingdom’s army, and I’m not sure if I’m going to make it out of this in one piece. They’re marching to battle, and I’m the bargaining chip that will either douse the fire or spark a war. At the heart of my fear, my worry, there’s him—Commander Rip. Known for his brutality on the battlefield, his viciousness is unsurpassed. But I know the truth about what he is. Fae. The betrayers. The murderers. The ones who nearly destroyed Orea, wiping out Seventh Kingdom in the process. Rip has power sizzling beneath this skin and glinting spikes down his spine. But his eyes—his eyes are the most compelling of all. When he turns those black eyes on me, I feel captive for an entirely different reason. I may be out of my cage, but I’m not free, not even close. In the game of kings and armies, I’m the gilded pawn. The question is, can I out maneuver them? This is the captivating second book of The Plated Prisoner series. It’s an adult epic fantasy story blending romance, intrigue, and beautiful imagery. Return to the seductive story of magic inspired by the myth of King Midas, and get caught up in the world of Orea. Please note: There is explicit language and romance in this book, not suitable for those under the age of 18."
Lindsay Markman,read,"Gild (The Plated Prisoner, #1)",Gild,The Plated Prisoner,1,Raven Kennedy,3,3.62,-0.62,Mixed/okay,2026-03-11,2026-03-19,402,2020,"",56483061,https://www.goodreads.com/review/show/8383164572,https://www.goodreads.com/book/show/56483061,https://i.gr-assets.com/images/S/compressed.photo.goodreads.com/books/1609357436l/56483061._SY475_.jpg,"",Fantasy Romance,Yes,Yes,Yes,"","The fae abandoned this world to us. And the ones with power rule. Gold. Gold floors, gold walls, gold furniture, gold clothes. In Highbell, in the castle built into the frozen mountains, everything is made of gold. Even me. King Midas rescued me. Dug me out of the slums and placed me on a pedestal. I’m called his precious. His favored. I’m the woman he Gold-Touched to show everyone that I belong to him. To show how powerful he is. He gave me protection, and I gave him my heart. And even though I don’t leave the confines of the palace, I’m safe. Until war comes to the kingdom and a deal is struck. Suddenly, my trust is broken. My love is challenged. And I realize that everything I thought I knew about Midas might be wrong. Because these bars I’m kept in, no matter how gilded, are still just a cage. But the monsters on the other side might make me wish I’d never left. The myth of King Midas reimagined. This compelling adult fantasy series is as addictive as it is unexpected. With romance, intrigue, and danger, the gilded world of Orea will grip you from the very first page. Please Note: This book contains explicit content and darker elements, including mature language, violence, and rape. It is not intended for anyone under 18 years of age. This is book one in a series. An alternative cover edition for this ASIN can be found here ."
Lindsay Markman,read,Alchemised,Alchemised,"","",SenLinYu,5,4.28,0.72,Loved,2026-03-08,2026-03-19,1030,2025,0593972708,222490389,https://www.goodreads.com/review/show/8383167498,https://www.goodreads.com/book/show/222490389,https://i.gr-assets.com/images/S/compressed.photo.goodreads.com/books/1737131981l/222490389._SY475_.jpg,"",Fiction,Yes,"",Yes,"","“What is it you think you’re protecting in that brain of yours? The war is over. Holdfast is dead. The Eternal Flame extinguished. There’s no one left for you to save.” Once a promising alchemist, Helena Marino is now a prisoner—of war and of her own mind. Her Resistance friends and allies have been brutally murdered, her abilities suppressed, and the world she knew destroyed. In the aftermath of a long war, Paladia’s new ruling class of corrupt guild families and depraved necromancers, whose vile undead creatures helped bring about their victory, holds Helena captive. According to Resistance records, she was a healer of little importance within their ranks. But Helena has inexplicable memory loss of the months leading up to her capture, making her enemies wonder: Is she truly as insignificant as she appears, or are her lost memories hiding some vital piece of the Resistance’s final gambit? To uncover the memories buried deep within her mind, Helena is sent to the High Reeve, one of the most powerful and ruthless necromancers in this new world. Trapped on his crumbling estate, Helena’s fight—to protect her lost history and to preserve the last remaining shreds of her former self—is just beginning. For her prison and captor have secrets of their own . . . secrets Helena must unearth, whatever the cost."
Lindsay Markman,read,My Friends,My Friends,"","",Fredrik Backman,4,4.29,-0.29,Liked a lot,2026-03-06,2026-03-19,436,2025,1982112824,217163697,https://www.goodreads.com/review/show/8306122253,https://www.goodreads.com/book/show/217163697,https://i.gr-assets.com/images/S/compressed.photo.goodreads.com/books/1734625930l/217163697._SY475_.jpg,"",Fiction,Yes,"","","","Most people don’t even notice them—three tiny figures sitting at the end of a long pier in the corner of one of the most famous paintings in the world. Most people think it’s just a depiction of the sea. But Louisa, an aspiring artist herself, knows otherwise, and she is determined to find out the story of these three enigmatic figures. Twenty-five years earlier, in a distant seaside town, a group of teenagers find refuge from their bruising home lives by spending long summer days on an abandoned pier, telling silly jokes, sharing secrets, and committing small acts of rebellion. These lost souls find in each other a reason to get up each morning, a reason to dream, a reason to love. Out of that summer emerges a transcendent work of art, a painting that will unexpectedly be placed into eighteen-year-old Louisa’s care. She embarks on a surprise-filled cross-country journey to learn how the painting came to be and to decide what to do with it. The closer she gets to the painting’s birthplace, the more nervous she becomes about what she’ll find. Louisa is proof that happy endings don’t always take the form we expect in this stunning testament to the transformative, timeless power of friendship and art."
Lindsay Markman,read,"Fourth Wing (The Empyrean, #1)",Fourth Wing,The Empyrean,1,Rebecca Yarros,5,4.54,0.46,Loved,2026-02-28,2026-02-28,517,2023,1649374046,61431922,https://www.goodreads.com/review/show/8282441975,https://www.goodreads.com/book/show/61431922,https://i.gr-assets.com/images/S/compressed.photo.goodreads.com/books/1761312598l/61431922._SY475_.jpg,"",Fantasy Romance,Yes,Yes,Yes,"","A #1 New York Times bestseller • TV series in development at MGM Amazon Studios with Michael B. Jordan’s Outlier Society • Amazon Best Books of the Year, #4 • Apple Best Books of the Year 2023 • Barnes &amp; Noble Best Fantasy Book of 2023 • NPR “Books We Love” 2023 • Audible Best Books of 2023 • Hudson Book of the Year • Google Play Best Books of 2023 • Indigo Best Books of 2023 • Waterstones Book of the Year finalist • Goodreads Choice Award Winner • Newsweek Staffers’ Favorite Books of 2023 • Paste Magazine's Best Books of 2023 ""Suspenseful, sexy, and with incredibly entertaining storytelling, the first in Yarros' Empyrean series will delight fans of romantic, adventure-filled fantasy."" ―Booklist, starred review ""Fourth Wing will have your heart pounding from beginning to end... A fantasy like you've never read before."" ―#1 New York Times bestselling author Jennifer L. Armentrout Enter the brutal and elite world of a war college for dragon riders from #1 New York Times bestselling author Rebecca Yarros Twenty-year-old Violet Sorrengail was supposed to enter the Scribe Quadrant, living a quiet life among books and history. Now, the commanding general―also known as her tough-as-talons mother―has ordered Violet to join the hundreds of candidates striving to become the elite of Navarre: dragon riders. But when you’re smaller than everyone else and your body is brittle, death is only a heartbeat away...because dragons don’t bond to “fragile” humans. They incinerate them. With fewer dragons willing to bond than cadets, most would kill Violet to better their own chances of success. The rest would kill her just for being her mother’s daughter―like Xaden Riorson, the most powerful and ruthless wingleader in the Riders Quadrant. She’ll need every edge her wits can give her just to see the next sunrise. Yet, with every day that passes, the war outside grows more deadly, the kingdom's protective wards are failing, and the death toll continues to rise. Even worse, Violet begins to suspect leadership is hiding a terrible secret. Friends, enemies, lovers. Everyone at Basgiath War College has an agenda―because once you enter, there are only two ways out: graduate or die. The Empyrean series is best enjoyed in order. Reading Order: Book #1 Fourth Wing Book #2 Iron Flame Book #3 Onyx Storm"
Lindsay Markman,read,Heart the Lover,Heart the Lover,"","",Lily King,5,4.17,0.83,Loved,2026-02-27,2026-02-27,256,2025,0802165176,228110489,https://www.goodreads.com/review/show/8306146620,https://www.goodreads.com/book/show/228110489,https://i.gr-assets.com/images/S/compressed.photo.goodreads.com/books/1745508457l/228110489._SY475_.jpg,"",Romance,Yes,"","","","You knew I’d write a book about you someday. Our narrator understands good love stories—their secrets and subtext, their highs and their free falls. But her greatest love story, the one she lived, never followed the simple rules. In the fall of her senior year of college, she meets two star students from her 17th-Century Lit class: Sam and Yash. Best friends living off-campus in the elegant house of a professor on sabbatical, the boys invite her into their intoxicating world of academic fervor, rapid-fire banter and raucous card games. They nickname her Jordan, and she quickly discovers the pleasures of friendship, love and her own intellectual ambition. Youthful passion is unpredictable though, and she soon finds herself at the center of a charged and intricate triangle. As graduation comes and goes, choices made will alter these three lives forever. Decades later, Jordan is living the life she dreamed of, and the vulnerable days of her youth seem comfortably behind her. But when a surprise visit and unexpected news brings the past crashing into the present, Jordan returns to a world she left behind and is forced to confront the decisions and deceptions of her younger self. Written with the superb wit and emotional sensitivity fans and critics of Lily King have come to adore, Heart the Lover is a deeply moving story that celebrates love, friendship, and the transformative nature of forgiveness. Wise, unforgettable, and with a delightful connective thread to Writers &amp; Lovers , this is King at her very best, affirming her as a masterful chronicler of the human experience and one of the finest novelists at work today."
Lindsay Markman,read,I Who Have Never Known Men,I Who Have Never Known Men,"","",Jacqueline Harpman,4,4.01,-0.01,Liked a lot,2026-02-26,2026-02-26,173,1995,1945492600,60811826,https://www.goodreads.com/review/show/8306060501,https://www.goodreads.com/book/show/60811826,https://i.gr-assets.com/images/S/compressed.photo.goodreads.com/books/1649947133l/60811826._SY475_.jpg,"",Fiction,"","","","","Deep underground, forty women live imprisoned in a cage. Watched over by guards, the women have no memory of how they got there, no notion of time, and only a vague recollection of their lives before. As the burn of electric light merges day into night and numberless years pass, a young girl—the fortieth prisoner—sits alone and outcast in the corner. Soon she will show herself to be the key to the others' escape and survival in the strange world that awaits them above ground. Jacqueline Harpman was born in Etterbeek, Belgium, in 1929, and fled to Casablanca with her family during WWII. Informed by her background as a psychoanalyst and her youth in exile, I Who Have Never Known Men is a haunting, heartbreaking post-apocalyptic novel of female friendship and intimacy, and the lengths people will go to maintain their humanity in the face of devastation. Back in print for the first time since 1997, Harpman’s modern classic is an important addition to the growing canon of feminist speculative literature."
