Account,Shelf,Title,Base Title,Series,Series Number,Author,Lindsay Rating,Goodreads Avg Rating,Rating Delta,Rating Band,Read Date,Date Added,Pages,Published Year,ISBN,Goodreads Book ID,Goodreads Review URL,Goodreads Book URL,Cover URL,Other Shelves,Inferred Category,Romance?,Fantasy/Paranormal?,Dark/Thriller?,Review Text,Description
Lindsay Markman,read,"Sinners Anonymous (Sinners Anonymous, #1)",Sinners Anonymous,Sinners Anonymous,1,Somme Sketcher,2,3.82,-1.82,Low,2026-05-28,2026-05-28,348,2021,"",59818980,https://www.goodreads.com/review/show/8622869234,https://www.goodreads.com/book/show/59818980,https://i.gr-assets.com/images/S/compressed.photo.goodreads.com/books/1639431375l/59818980._SY475_.jpg,"",Romance,Yes,"",Yes,"","My fiancé’s nephew knows every sin I’ve ever committed. He’s about to become the deepest and darkest of them all. My name is Rory Carter and I do bad things. There’s a charred soul under this angelic exterior and sometimes, I wonder if my weekly confessions to the Sinners Anonymous hotline will be enough to heal it. Marrying the seventy-something head of the Cosa Nostra to save my father is the only good deed I’ve ever done. I’m burning and bitter under the fake smile and tight dresses, but I was keeping it together. Was. Until my fiancé’s nephew turns up to dinner uninvited. Angelo ‘Vicious' Visconti. A beautiful monster with cheekbones as sharp as his tongue. They say I shouldn’t be scared of him, because nine years ago, he went straight. He’s barely a Made Man anymore. But I say, he’s the most dangerous Visconti of all. It’s not just because his cold sneer makes my pulse flutter. Or the way his syrupy drawl trickles down my spine. No. He holds all of my sins in his big, rough hands. And the only sins darker than mine are his own. DARK MAFIA ROMANCE - FORBIDDEN LOVE - AGE GAP - ENEMIES TO LOVERS"
Lindsay Markman,read,"The Darkest Temptation (Made, #3)",The Darkest Temptation,Made,3,Danielle Lori,4,4.03,-0.03,Liked a lot,2026-05-26,2026-05-26,410,2020,"",56250307,https://www.goodreads.com/review/show/8630366130,https://www.goodreads.com/book/show/56250307,https://i.gr-assets.com/images/S/compressed.photo.goodreads.com/books/1607700241l/56250307._SX318_.jpg,"",Romance,Yes,"",Yes,"","""This story is dark romance at its best. Simply perfection!"" – Charmaine Pauls, USA Today bestselling author A fortune teller once told Mila she’d find a man who would take her breath away. She refrained from telling her it would be literally while Mila ran for her life. Having always done what is expected of her, Mila dresses the part, only dates college boys with exemplary backgrounds, and doesn’t ask questions. Not about her papa’s absences or his refusal to let her set foot in her birthplace—Russia. Suffocated by the rules and unanswered questions, Mila does what she’s always wanted to. She boards a plane to Moscow. She never expected to fall for a man on the way. One with unexplained wealth, tattoos on his hands, and secrets in his eyes. But it doesn’t take long for his caress to become a rough grasp muffling her screams. Revenge is a dish best served cold. Unfortunately, a Russian winter is the coldest of them all, and Mila soon learns the only way to escape intact is to do the impossible and thaw her captor’s heart."
Lindsay Markman,read,"The Maddest Obsession (Made, #2)",The Maddest Obsession,Made,2,Danielle Lori,4,4.35,-0.35,Liked a lot,2026-05-24,2026-05-26,376,2019,"",45050360,https://www.goodreads.com/review/show/8625752679,https://www.goodreads.com/book/show/45050360,https://i.gr-assets.com/images/S/compressed.photo.goodreads.com/books/1555280714l/45050360._SY475_.jpg,"",Thriller / Suspense,"","",Yes,"","She fears the dark. He rules it. Her dresses are too tight, her heels too tall. She laughs too loudly, eats without decorum, and mixes up most sayings in the book. Little do most know it’s just a sparkly disguise, there to hide one panic attack at a time. Nobody can crack Gianna’s facade . . . no one anyway, until he comes along. Most see a paragon of morality; a special agent upholding the law. In the New York underworld, others know him as a hustler, a killer, his nature as cold as the heart of ice in his chest. Christian Allister has always followed the life plan he’d envisioned in his youth, beneath the harsh lights of a frigid, damp cell. With a proclivity for order and the number three, he’s never been tempted to veer off course. But perhaps one should never say never . . . One winter night and their lives intertwine. She hates him—his stone-cold demeanor, his arrogance and too-perceptive eye—but over the years, even as their games consist of insulting each other’s looks and intelligence, she begins to live to play with him. Nowhere in Christian’s plans had he ever prepared for Gianna. She’s chaos embodied, not his type, and married, but none of that can stop his eyes from following her wherever she goes. All along, she doesn’t even know that she’s his—his frustration, his fascination."
Lindsay Markman,read,The Bright Years,The Bright Years,"","",Sarah Damoff,4,4.21,-0.21,Liked a lot,2026-05-04,2026-05-24,288,2025,1668061449,214152211,https://www.goodreads.com/review/show/8562452641,https://www.goodreads.com/book/show/214152211,https://i.gr-assets.com/images/S/compressed.photo.goodreads.com/books/1717697006l/214152211._SY475_.jpg,"",Fiction,Yes,"","","","One family. Four generations. A secret son. A devastating addiction. A Texas family is met with losses and surprises of inheritance, but they’re unable to shake the pull back toward each other in this big-hearted family saga perfect for readers of Mary Beth Keane and Claire Lombardo. Ryan and Lillian Bright are deeply in love, recently married, and now parents to a baby girl, Georgette. But Lillian has a son she hasn’t told Ryan about, and Ryan has an alcohol addiction he hasn’t told Lillian about, so Georgette comes of age watching their marriage rise and fall. When a shocking blow scatters their fragile trio, Georgette tries to distance herself from reminders of her parents. Years later, Lillian’s son comes searching for his birth family, so Georgette must return to her roots, unearth her family’s history, and decide whether she can open up to love for them—or herself—while there’s still time. Told from three intimate points of view, The Bright Years is a tender, true-to-life novel that explores the impact of each generation in a family torn apart by tragedy but, over time, restored by the power of grace and love."
Lindsay Markman,read,"The Sweetest Oblivion (Made, #1)",The Sweetest Oblivion,Made,1,Danielle Lori,4,4.19,-0.19,Liked a lot,2026-05-23,2026-05-23,386,2018,"",40577044,https://www.goodreads.com/review/show/8622867301,https://www.goodreads.com/book/show/40577044,https://i.gr-assets.com/images/S/compressed.photo.goodreads.com/books/1684847027l/40577044._SY475_.jpg,"",Romance,Yes,"",Yes,"","She’s a romantic at heart, living in the most unromantic of worlds . . . Nicknamed Sweet Abelli for her docile nature, Elena smiles on cue and has a charming response for everything. She’s the favored daughter, the perfect mafia principessa . . . or was. Now, all she can see in the mirror’s reflection is blood staining her hands like crimson paint. They say first impressions are everything . . . In the murky waters of New York’s underworld, Elena’s sister is arranged to marry Nicolas Russo. A Made Man, a boss, a cheat—even measured against mafia standards. His reputation stretches far and wide and is darker than his black suits and ties. After his and Elena’s first encounter ends with an accidental glare on her part, she realizes he’s just as rude as he is handsome. She doesn’t like the man or anything he stands for, though that doesn’t stop her heart from pattering like rain against glass when he’s near, nor the shiver that ghosts down her spine at the sound of his voice. And he’s always near. Telling her what to do. Making her feel hotter than any future brother-in-law should. Elena may be the Sweet Abelli on the outside, but she’s beginning to learn she has a taste for the darkness, for rough hands, cigarettes, and whiskey-colored eyes. Having already escaped one scandal, however, she can hardly afford to be swept up in another. Besides, even if he were hers, everyone knows you don’t fall in love with a Made Man . . . right? This is a standalone forbidden romance."
Lindsay Markman,read,"The Right Move (Windy City, #2)",The Right Move,Windy City,2,Liz Tomforde,3,4.37,-1.37,Mixed/okay,2026-05-22,2026-05-22,499,2023,"",84943172,https://www.goodreads.com/review/show/8619432818,https://www.goodreads.com/book/show/84943172,https://i.gr-assets.com/images/S/compressed.photo.goodreads.com/books/1674590603l/84943172._SY475_.jpg,"",Sci-Fi / Dystopian,Yes,"","","","RYAN I’m the newest Captain of the Devils, Chicago’s NBA team, and the last thing I needed this year was for Indy Ivers, my sister’s best friend, to move into my apartment. She’s messy, emotional, and way too tempting. But when the team’s General Manager vocalizes his blatant disapproval of my promotion to Captain, referring to me as an unapproachable lone wolf with no work-life balance, I can’t think of a better way to convince him otherwise than pretending to date my outgoing roommate. The only problem? Faking it feels far too natural. Having a fake girlfriend wasn’t supposed to be messy but having Indy under my roof and in my bed is complicated, especially when she wants all the romantic parts of life that I could never give her. INDY I never imagined I’d be living with my best friend’s brother, NBA superstar Ryan Shay. Even more unbelievable? He needs me to act as his loving girlfriend who’s suddenly changed him into a friendly and approachable guy. Because, well…he’s not. He’s controlling of his space and untrusting of others. Our arrangement isn’t one-sided, though. I’m in a wedding coming up, one where every one of my childhood friends, including my ex-boyfriend, will be in attendance, and there’s no better date than my ex’s celebrity hero. Blurred lines make it almost impossible to separate real from fake. Falling for my roommate was never part of the deal, especially when Ryan is quick to remind me that he doesn’t believe in love. I’m a romantic and can’t help fantasizing that he’ll change, but soon enough, I find myself questioning if sharing a roof with my best friend’s brother was the right move after all"
Lindsay Markman,read,"Play Along (Windy City, #4)",Play Along,Windy City,4,Liz Tomforde,4,4.43,-0.43,Liked a lot,2026-05-20,2026-05-20,384,2024,"",199285128,https://www.goodreads.com/review/show/8615044609,https://www.goodreads.com/book/show/199285128,https://i.gr-assets.com/images/S/compressed.photo.goodreads.com/books/1710337914l/199285128._SY475_.jpg,"",Fiction,Yes,"","","","Kennedy I’m the only woman on staff for the Windy City Warriors, and after years of putting up with a sexist lead doctor, I’m desperate to land my dream job with a new team next year. All I have to do is maintain my professional reputation for my final season in Chicago. But a Las Vegas run-in with the team’s shortstop threatens it all, leaving me with a fuzzy memory and a ring on my left hand. Now, not only am I legally bound to the most persistent man I’ve ever met, but thanks to Isaiah’s scheme to save my job, I have to pretend the whole thing was a planned elopement and not a drunken mistake. Isaiah Rhodes is reckless, impulsive, and frustratingly charming. He’s also my brand-new husband. They got the saying wrong. What happens in Vegas doesn’t always stay in Vegas… sometimes it follows you right back home. Isaiah As the shortstop for Chicago’s professional baseball team, I’ve had my fair share of fun. But that all ended the day Kennedy Kay became a single woman. I’ve crushed on the team’s athletic trainer for years. I’ve flirted to no avail, so imagine my surprise when I woke up in Sin City with a ring on my finger and my favorite redhead in my bed. We agree to stay married for one baseball season, just long enough to keep her job safe, but in my mind, I’m using our time together to prove to her I’m husband material. Kennedy might be reluctant to join in on our game, but it’s one I refuse to lose. So come on, wife… play along."
Lindsay Markman,read,"Caught Up (Windy City, #3)",Caught Up,Windy City,3,Liz Tomforde,4,4.38,-0.38,Liked a lot,2026-05-19,2026-05-19,408,2023,139972858X,199335111,https://www.goodreads.com/review/show/8611615553,https://www.goodreads.com/book/show/199335111,https://i.gr-assets.com/images/S/compressed.photo.goodreads.com/books/1696911001l/199335111._SY475_.jpg,"",Fiction,"","","","","Kai I’m a single dad and starting pitcher for Chicago’s MLB team. I’m stretched too thin, but I don’t want help raising my son. Each of his previous nannies only lasted a few weeks before I let them go. Now, my coach is putting his foot down by hiring the one person I can’t fire—his daughter. Miller Montgomery is the last woman I should fall for. Too wild, too young, and too unattached. Chicago is just a quick stop for her. I thought I’d be counting down the days until she left, but summer feels too short when I start thinking about forever. Miller As a high-end pastry chef who recently won the most prestigious award in my industry, I’m desperate to prove I deserve it. But with a new title comes new pressure, and I can’t create a fresh and inspiring dessert to save my life. With only two months to get back on track, I should be focusing in the kitchen, but instead, I let my dad talk me into using my time off to nanny for his star player’s kid. Kai Rhodes forgot how to have fun, and I’m eager to jog his memory. But when he and his son start to feel like home, I have to remind us both that my time in Chicago ends with the summer. Besides, I’ve always been a runner, and the last thing I want is to get caught."
Lindsay Markman,read,"Lawless God (North Shore, #4)",Lawless God,North Shore,4,Lola King,4,4.20,-0.2,Liked a lot,2026-05-17,2026-05-17,622,2024,1916837077,202195805,https://www.goodreads.com/review/show/8608684953,https://www.goodreads.com/book/show/202195805,https://i.gr-assets.com/images/S/compressed.photo.goodreads.com/books/1712151004l/202195805._SY475_.jpg,"",Fiction,Yes,"","","","I sent a psychopath to prison. Now he's out and back for revenge. They call me Kayla ‘The Ruthless’ King. The Queen of the North Shore and leader of the Kings’ Crew. Because of the sacrifices I’ve made and the merciless way I run my crew, the North Shore belongs to me. In our town, you can only thrive if you're the worst of the worst. But that all ended when the psychopath I put away returned with a target on my back. If I'm The Ruthless King, Nathan White is The Lawless God. The biggest and baddest of them all. He's heartless and cruel, and everyone is safer out of his way. Including me. When he comes back to the North Shore with only my name on his lips, I know my days are numbered. Or so I thought until he took me. Nathan doesn't want me dead. He wants me to suffer. And what better way than to keep me captive as he destroys my crew and legacy. I'm fighting a war that I'm unprepared for, and in the midst of chaos, my feelings blur with the need for survival. My secrets aren't safe anymore, and neither is my heart. You know what they say? Never fall in love with the enemy. Too late for that. This book is a standalone in a series of interconnected standalones. It can be read on its own."
Lindsay Markman,read,Lost Lambs,Lost Lambs,"","",Madeline Cash,5,3.85,1.15,Loved,2026-05-13,2026-05-13,323,2026,0374619239,231127175,https://www.goodreads.com/review/show/8562452221,https://www.goodreads.com/book/show/231127175,https://i.gr-assets.com/images/S/compressed.photo.goodreads.com/books/1749784923l/231127175._SY475_.jpg,"",Thriller / Suspense,"","",Yes,"","Rippling with humor, warmth, and style, Lost Lambs is a new vision of the charms and pitfalls of family dysfunction. The Flynn family is coming undone. Catherine and Bud's open marriage has reached its breaking point as their daughters spiral in their own chaotic: Abigail, the eldest, is dating a man in his twenties nicknamed War Crime Wes; Louise, the middle child, maintains a secret correspondence with an online terrorist; the brilliant youngest, Harper, is being sent to wilderness reform camp due to her insistence that someone—or something—is monitoring the town’s citizens. Casting a shadow across their lives, and their small coastal town, is Paul Alabaster, a billionaire shipping magnate. Rumors of corruption circulate, but no one dares dig too deep. No one except Harper, whose obsession with a mysterious shipping container sends the family hurtling into a criminal conspiracy—one that may just bring them closer together. Irreverent and addictive, pinging between the voices of the Flynn family and those of the panorama of characters around them, Madeline Cash’s Lost Lambs is a debut novel of quick-witted observation and surprising tenderness. With Lost Lambs , Cash has crafted a family saga for the twenty-first century, all held together with crazy glue."
Lindsay Markman,read,Remarkably Bright Creatures,Remarkably Bright Creatures,"","",Shelby Van Pelt,4,4.34,-0.34,Liked a lot,2026-05-12,2026-05-12,360,2022,0063204150,58733693,https://www.goodreads.com/review/show/8577303033,https://www.goodreads.com/book/show/58733693,https://i.gr-assets.com/images/S/compressed.photo.goodreads.com/books/1651600548l/58733693._SY475_.jpg,"",Fiction,"","","","","Remarkably Bright Creatures , an exploration of friendship, reckoning, and hope, tracing a widow's unlikely connection with a giant Pacific octopus . After Tova Sullivan's husband died, she began working the night shift at the Sowell Bay Aquarium, mopping floors and tidying up. Keeping busy has always helped her cope, which she's been doing since her eighteen-year-old son, Erik, mysteriously vanished on a boat in Puget Sound over thirty years ago. Tova becomes acquainted with curmudgeonly Marcellus, a giant Pacific octopus living at the aquarium. Marcellus knows more than anyone can imagine but wouldn't dream of lifting one of his eight arms for his human captors--until he forms a remarkable friendship with Tova. Ever the detective, Marcellus deduces what happened the night Tova's son disappeared. And now Marcellus must use every trick his old invertebrate body can muster to unearth the truth for her before it's too late. Shelby Van Pelt's debut novel is a gentle reminder that sometimes taking a hard look at the past can help uncover a future that once felt impossible."
Lindsay Markman,read,"The Night Prince (The Wolf King, #2)",The Night Prince,The Wolf King,2,Lauren Palphreyman,4,4.38,-0.38,Liked a lot,2026-05-11,2026-05-11,498,2025,"",223259676,https://www.goodreads.com/review/show/8570512628,https://www.goodreads.com/book/show/223259676,https://i.gr-assets.com/images/S/compressed.photo.goodreads.com/books/1736014976l/223259676._SY475_.jpg,"",Fiction,"",Yes,Yes,"","Aurora is caught between powerful alphas as they fight for the Wolf Throne. But darker forces are rising. . . Aurora may have survived the Wolf King. But his bite marks her skin, and in accordance with Wolf Law, that makes her his property. Now, he wants her back. To beat him and take his throne, Aurora and Callum must form a dangerous alliance with one of the most feared Wolves in the Kingdom, Blake. He is their enemy, but he has entangled his life with Aurora’s—meaning she cannot harm him without forfeiting her own life. As she fights to break their connection, she suspects Blake is keeping secrets about a dark power that rises in the north, and the unsettling nature of the bond between them. It seems there is a bigger game at play than who sits on the Wolf Throne—one that threatens both the Kingdom of Wolves, and the Kingdom of Men. With her wolf awakening, enemies closing in, relationships tested, and secrets revealed—Aurora may be the only one who can stop an ancient evil from rising. If she can figure out who to trust. If she can figure out where she, and her heart, belong. If she can stay alive."
Lindsay Markman,read,The Nightingale,The Nightingale,"","",Kristin Hannah,4,4.64,-0.64,Liked a lot,2026-03-23,2026-05-07,564,2015,0312577222,21853621,https://www.goodreads.com/review/show/8312169580,https://www.goodreads.com/book/show/21853621,https://i.gr-assets.com/images/S/compressed.photo.goodreads.com/books/1681839850l/21853621._SY475_.jpg,"",Fiction,Yes,"","","","In love we find out who we want to be. In war we find out who we are. France, 1939 In the quiet village of Carriveau, Vianne Mauriac says goodbye to her husband, Antoine, as he heads for the Front. She doesn't believe that the Nazis will invade France…but invade they do, in droves of marching soldiers, in caravans of trucks and tanks, in planes that fill the skies and drop bombs upon the innocent. When a German captain requisitions Vianne's home, she and her daughter must live with the enemy or lose everything. Without food or money or hope, as danger escalates all around them, she is forced to make one impossible choice after another to keep her family alive. Vianne's sister, Isabelle, is a rebellious eighteen-year-old, searching for purpose with all the reckless passion of youth. While thousands of Parisians march into the unknown terrors of war, she meets Gäetan, a partisan who believes the French can fight the Nazis from within France, and she falls in love as only the young can…completely. But when he betrays her, Isabelle joins the Resistance and never looks back, risking her life time and again to save others. With courage, grace, and powerful insight, bestselling author Kristin Hannah captures the epic panorama of World War II and illuminates an intimate part of history seldom seen: the women's war. The Nightingale tells the stories of two sisters, separated by years and experience, by ideals, passion and circumstance, each embarking on her own dangerous path toward survival, love, and freedom in German-occupied, war-torn France―a heartbreakingly beautiful novel that celebrates the resilience of the human spirit and the durability of women. It is a novel for everyone, a novel for a lifetime."
Lindsay Markman,read,The Great Alone,The Great Alone,"","",Kristin Hannah,5,4.46,0.54,Loved,2026-05-07,2026-05-07,435,2018,"",34912895,https://www.goodreads.com/review/show/8562172215,https://www.goodreads.com/book/show/34912895,https://i.gr-assets.com/images/S/compressed.photo.goodreads.com/books/1501852423l/34912895._SY475_.jpg,"",Fiction,Yes,"",Yes,"","Alaska, 1974. Unpredictable. Unforgiving. Untamed. For a family in crisis, the ultimate test of survival. Ernt Allbright, a former POW, comes home from the Vietnam war a changed and volatile man. When he loses yet another job, he makes an impulsive decision: he will move his family north, to Alaska, where they will live off the grid in America’s last true frontier. Thirteen-year-old Leni, a girl coming of age in a tumultuous time, caught in the riptide of her parents’ passionate, stormy relationship, dares to hope that a new land will lead to a better future for her family. She is desperate for a place to belong. Her mother, Cora, will do anything and go anywhere for the man she loves, even if it means following him into the unknown. At first, Alaska seems to be the answer to their prayers. In a wild, remote corner of the state, they find a fiercely independent community of strong men and even stronger women. The long, sunlit days and the generosity of the locals make up for the Allbrights’ lack of preparation and dwindling resources. But as winter approaches and darkness descends on Alaska, Ernt’s fragile mental state deteriorates and the family begins to fracture. Soon the perils outside pale in comparison to threats from within. In their small cabin, covered in snow, blanketed in eighteen hours of night, Leni and her mother learn the terrible truth: they are on their own. In the wild, there is no one to save them but themselves. In this unforgettable portrait of human frailty and resilience, Kristin Hannah reveals the indomitable character of the modern American pioneer and the spirit of a vanishing Alaska―a place of incomparable beauty and danger. The Great Alone is a daring, beautiful, stay-up-all-night story about love and loss, the fight for survival, and the wildness that lives in both man and nature."
Lindsay Markman,read,"Crown Me Dead (Heartstring Duet, #1)",Crown Me Dead,Heartstring Duet,1,Liv Zander,4,4.19,-0.19,Liked a lot,2026-05-06,2026-05-06,270,2026,1955871140,250681590,https://www.goodreads.com/review/show/8558875330,https://www.goodreads.com/book/show/250681590,https://i.gr-assets.com/images/S/compressed.photo.goodreads.com/books/1775423929l/250681590._SY475_.jpg,"",Fantasy / Paranormal,"",Yes,"","","Wed me. Bed me. Slit my throat. Born in dirt, raised in rot, I dig graves for the dead, while the living decay around me. When my brother coughs blood, he appears. A man too polished for the graveyard, with a bargain too cruel for the light: Seduce the King. Become the Queen. Die. And my brother lives. Kael is a nightmare of living ruin, the rotting ruler of a festering realm. And Vale is his shadow, the cold architect of my demise. One man needs my heart to beat. The other plans to stop it forever. They think I’m a pawn. But I’m the gravedigger's daughter. And I know exactly where to bury them. Welcome to the funeral."
